addrcode,subdistrict_th,subdistrict_en,district_code,district_th,district_en,province_code,province_th,province_en,LAT,LONG,Population
100101,พระบรมมหาราชวัง,Phra Borom Maha Ratchawang,1001,พระนคร,Phra Nakhon,10,กรุงเทพมหานคร,Bangkok,13.751,100.492,4089
100102,วังบูรพาภิรมย์,Wang Burapha Phirom,1001,พระนคร,Phra Nakhon,10,กรุงเทพมหานคร,Bangkok,13.744,100.499,11586
100103,วัดราชบพิธ,Wat Ratchabophit,1001,พระนคร,Phra Nakhon,10,กรุงเทพมหานคร,Bangkok,13.75,100.499,3402
100104,สำราญราษฎร์,Samran Rat,1001,พระนคร,Phra Nakhon,10,กรุงเทพมหานคร,Bangkok,13.751,100.503,3431
100105,ศาลเจ้าพ่อเสือ,San Chaopho Suea,1001,พระนคร,Phra Nakhon,10,กรุงเทพมหานคร,Bangkok,13.754,100.497,3280
100106,เสาชิงช้า,Sao Chingcha,1001,พระนคร,Phra Nakhon,10,กรุงเทพมหานคร,Bangkok,13.753,100.5,2360
100107,บวรนิเวศ,Bowon Niwet,1001,พระนคร,Phra Nakhon,10,กรุงเทพมหานคร,Bangkok,13.757,100.501,5079
100108,ตลาดยอด,Talat Yot,1001,พระนคร,Phra Nakhon,10,กรุงเทพมหานคร,Bangkok,13.76,100.498,2578
100109,ชนะสงคราม,Chana Songkhram,1001,พระนคร,Phra Nakhon,10,กรุงเทพมหานคร,Bangkok,13.762,100.495,2021
100110,บ้านพานถม,Ban Phan Thom,1001,พระนคร,Phra Nakhon,10,กรุงเทพมหานคร,Bangkok,13.762,100.503,6980
100111,บางขุนพรหม,Bang Khun Phrom,1001,พระนคร,Phra Nakhon,10,กรุงเทพมหานคร,Bangkok,13.765,100.505,4732
100112,วัดสามพระยา,Wat Sam Phraya,1001,พระนคร,Phra Nakhon,10,กรุงเทพมหานคร,Bangkok,13.768,100.499,2984
100201,ดุสิต,Dusit,1002,ดุสิต,Dusit,10,กรุงเทพมหานคร,Bangkok,13.772,100.513,13954
100202,วชิรพยาบาล,Wachira Phayaban,1002,ดุสิต,Dusit,10,กรุงเทพมหานคร,Bangkok,13.778,100.505,11600
100203,สวนจิตรลดา,Suan Chit Lada,1002,ดุสิต,Dusit,10,กรุงเทพมหานคร,Bangkok,13.767,100.52,9438
100204,สี่แยกมหานาค,Si Yaek Maha Nak,1002,ดุสิต,Dusit,10,กรุงเทพมหานคร,Bangkok,13.758,100.517,7585
100206,ถนนนครไชยศรี,,1002,ดุสิต,Dusit,10,กรุงเทพมหานคร,Bangkok,13.789,100.522,55873
100301,กระทุ่มราย,,1003,หนองจอก,Nong Chok,10,กรุงเทพมหานคร,Bangkok,13.823,100.897,37469
100302,หนองจอก,,1003,หนองจอก,Nong Chok,10,กรุงเทพมหานคร,Bangkok,13.869,100.885,20528
100303,คลองสิบ,,1003,หนองจอก,Nong Chok,10,กรุงเทพมหานคร,Bangkok,13.914,100.82,8823
100304,คลองสิบสอง,,1003,หนองจอก,Nong Chok,10,กรุงเทพมหานคร,Bangkok,13.914,100.88,10864
100305,โคกแฝด,,1003,หนองจอก,Nong Chok,10,กรุงเทพมหานคร,Bangkok,13.84,100.836,33455
100306,คู้ฝั่งเหนือ,,1003,หนองจอก,Nong Chok,10,กรุงเทพมหานคร,Bangkok,13.872,100.81,17434
100307,ลำผักชี,,1003,หนองจอก,Nong Chok,10,กรุงเทพมหานคร,Bangkok,13.797,100.844,29912
100308,ลำต้อยติ่ง,,1003,หนองจอก,Nong Chok,10,กรุงเทพมหานคร,Bangkok,13.781,100.877,9359
100401,มหาพฤฒาราม,,1004,บางรัก,Bang Rak,10,กรุงเทพมหานคร,Bangkok,13.734,100.52,11944
100402,สีลม,,1004,บางรัก,Bang Rak,10,กรุงเทพมหานคร,Bangkok,13.73,100.525,16245
100403,สุริยวงศ์,,1004,บางรัก,Bang Rak,10,กรุงเทพมหานคร,Bangkok,13.724,100.53,5345
100404,บางรัก,,1004,บางรัก,Bang Rak,10,กรุงเทพมหานคร,Bangkok,13.727,100.527,2902
100405,สี่พระยา,,1004,บางรัก,Bang Rak,10,กรุงเทพมหานคร,Bangkok,13.725,100.514,10872
100502,อนุสาวรีย์,,1005,บางเขน,Bang Khen,10,กรุงเทพมหานคร,Bangkok,13.868,100.606,95915
100508,ท่าแร้ง,,1005,บางเขน,Bang Khen,10,กรุงเทพมหานคร,Bangkok,13.866,100.65,94913
100601,คลองจั่น,,1006,บางกะปิ,Bang Kapi,10,กรุงเทพมหานคร,Bangkok,13.786,100.635,80437
100608,หัวหมาก,,1006,บางกะปิ,Bang Kapi,10,กรุงเทพมหานคร,Bangkok,13.756,100.66,67955
100701,รองเมือง,,1007,ปทุมวัน,Pathum Wan,10,กรุงเทพมหานคร,Bangkok,13.744,100.52,17655
100702,วังใหม่,,1007,ปทุมวัน,Pathum Wan,10,กรุงเทพมหานคร,Bangkok,13.742,100.526,7623
100703,ปทุมวัน,,1007,ปทุมวัน,Pathum Wan,10,กรุงเทพมหานคร,Bangkok,13.74,100.535,6059
100704,ลุมพินี,,1007,ปทุมวัน,Pathum Wan,10,กรุงเทพมหานคร,Bangkok,13.736,100.546,18257
100801,ป้อมปราบ,,1008,ป้อมปราบศัตรูพ่าย,Pom Prap Sattruphai,10,กรุงเทพมหานคร,Bangkok,13.743,100.514,15934
100802,วัดเทพศิรินทร์,,1008,ป้อมปราบศัตรูพ่าย,Pom Prap Sattruphai,10,กรุงเทพมหานคร,Bangkok,13.749,100.512,7294
100803,คลองมหานาค,,1008,ป้อมปราบศัตรูพ่าย,Pom Prap Sattruphai,10,กรุงเทพมหานคร,Bangkok,13.753,100.513,9807
100804,บ้านบาตร,,1008,ป้อมปราบศัตรูพ่าย,Pom Prap Sattruphai,10,กรุงเทพมหานคร,Bangkok,13.752,100.507,7189
100805,วัดโสมนัส,,1008,ป้อมปราบศัตรูพ่าย,Pom Prap Sattruphai,10,กรุงเทพมหานคร,Bangkok,13.759,100.511,7226
100905,บางจาก,,1009,พระโขนง,Phra Khanong,10,กรุงเทพมหานคร,Bangkok,13.692,100.626,91305
101001,มีนบุรี,,1010,มีนบุรี,Min Buri,10,กรุงเทพมหานคร,Bangkok,13.804,100.723,96899
101002,แสนแสบ,,1010,มีนบุรี,Min Buri,10,กรุงเทพมหานคร,Bangkok,13.812,100.774,44315
101101,ลาดกระบัง,,1011,ลาดกระบัง,Lat Krabang,10,กรุงเทพมหานคร,Bangkok,13.723,100.771,29474
101102,คลองสองต้นนุ่น,,1011,ลาดกระบัง,Lat Krabang,10,กรุงเทพมหานคร,Bangkok,13.753,100.723,66991
101103,คลองสามประเวศ,,1011,ลาดกระบัง,Lat Krabang,10,กรุงเทพมหานคร,Bangkok,13.753,100.754,15483
101104,ลำปลาทิว,,1011,ลาดกระบัง,Lat Krabang,10,กรุงเทพมหานคร,Bangkok,13.765,100.817,23696
101105,ทับยาว,,1011,ลาดกระบัง,Lat Krabang,10,กรุงเทพมหานคร,Bangkok,13.728,100.815,28320
101106,ขุมทอง,,1011,ลาดกระบัง,Lat Krabang,10,กรุงเทพมหานคร,Bangkok,13.736,100.855,7969
101203,ช่องนนทรี,,1012,ยานนาวา,Yannawa,10,กรุงเทพมหานคร,Bangkok,13.682,100.533,48997
101204,บางโพงพาง,,1012,ยานนาวา,Yannawa,10,กรุงเทพมหานคร,Bangkok,13.697,100.544,30577
101301,จักรวรรดิ,,1013,สัมพันธวงศ์,Samphanthawong,10,กรุงเทพมหานคร,Bangkok,13.741,100.504,7680
101302,สัมพันธวงศ์,,1013,สัมพันธวงศ์,Samphanthawong,10,กรุงเทพมหานคร,Bangkok,13.739,100.511,9201
101303,ตลาดน้อย,,1013,สัมพันธวงศ์,Samphanthawong,10,กรุงเทพมหานคร,Bangkok,13.734,100.513,7904
101401,สามเสนใน,,1014,พญาไท,Phaya Thai,10,กรุงเทพมหานคร,Bangkok,13.782,100.545,72102
101501,วัดกัลยาณ์,,1015,ธนบุรี,Thon Buri,10,กรุงเทพมหานคร,Bangkok,13.737,100.493,9340
101502,หิรัญรูจี,,1015,ธนบุรี,Thon Buri,10,กรุงเทพมหานคร,Bangkok,13.731,100.49,12693
101503,บางยี่เรือ,,1015,ธนบุรี,Thon Buri,10,กรุงเทพมหานคร,Bangkok,13.72,100.482,21903
101504,บุคคโล,,1015,ธนบุรี,Thon Buri,10,กรุงเทพมหานคร,Bangkok,13.707,100.486,17072
101505,ตลาดพลู,,1015,ธนบุรี,Thon Buri,10,กรุงเทพมหานคร,Bangkok,13.715,100.473,16408
101506,ดาวคะนอง,,1015,ธนบุรี,Thon Buri,10,กรุงเทพมหานคร,Bangkok,,,17647
101507,สำเหร่,,1015,ธนบุรี,Thon Buri,10,กรุงเทพมหานคร,Bangkok,,,15964
101601,วัดอรุณ,,1016,บางกอกใหญ่,Bangkok Yai,10,กรุงเทพมหานคร,Bangkok,13.743,100.486,13921
101602,วัดท่าพระ,,1016,บางกอกใหญ่,Bangkok Yai,10,กรุงเทพมหานคร,Bangkok,13.733,100.475,53966
101701,ห้วยขวาง,,1017,ห้วยขวาง,Huai Khwang,10,กรุงเทพมหานคร,Bangkok,13.769,100.577,25184
101702,บางกะปิ,,1017,ห้วยขวาง,Huai Khwang,10,กรุงเทพมหานคร,Bangkok,13.752,100.586,17056
101704,สามเสนนอก,,1017,ห้วยขวาง,Huai Khwang,10,กรุงเทพมหานคร,Bangkok,13.796,100.579,38950
101801,สมเด็จเจ้าพระยา,,1018,คลองสาน,Khlong San,10,กรุงเทพมหานคร,Bangkok,13.731,100.497,13667
101802,คลองสาน,,1018,คลองสาน,Khlong San,10,กรุงเทพมหานคร,Bangkok,13.735,100.504,16008
101803,บางลำภูล่าง,,1018,คลองสาน,Khlong San,10,กรุงเทพมหานคร,Bangkok,13.715,100.501,25128
101804,คลองต้นไทร,,1018,คลองสาน,Khlong San,10,กรุงเทพมหานคร,Bangkok,13.725,100.508,19068
101901,คลองชักพระ,,1019,ตลิ่งชัน,Taling Chan,10,กรุงเทพมหานคร,Bangkok,13.76,100.456,10660
101902,ตลิ่งชัน,,1019,ตลิ่งชัน,Taling Chan,10,กรุงเทพมหานคร,Bangkok,13.789,100.459,25132
101903,ฉิมพลี,,1019,ตลิ่งชัน,Taling Chan,10,กรุงเทพมหานคร,Bangkok,13.786,100.432,24503
101904,บางพรม,,1019,ตลิ่งชัน,Taling Chan,10,กรุงเทพมหานคร,Bangkok,13.752,100.442,13845
101905,บางระมาด,,1019,ตลิ่งชัน,Taling Chan,10,กรุงเทพมหานคร,Bangkok,13.767,100.431,19436
101907,บางเชือกหนัง,,1019,ตลิ่งชัน,Taling Chan,10,กรุงเทพมหานคร,Bangkok,13.751,100.419,11713
102004,ศิริราช,,1020,บางกอกน้อย,Bangkok Noi,10,กรุงเทพมหานคร,Bangkok,13.759,100.481,16652
102005,บ้านช่างหล่อ,,1020,บางกอกน้อย,Bangkok Noi,10,กรุงเทพมหานคร,Bangkok,13.752,100.477,32419
102006,บางขุนนนท์,,1020,บางกอกน้อย,Bangkok Noi,10,กรุงเทพมหานคร,Bangkok,13.774,100.466,9511
102007,บางขุนศรี,,1020,บางกอกน้อย,Bangkok Noi,10,กรุงเทพมหานคร,Bangkok,13.76,100.463,33291
102009,อรุณอมรินทร์,,1020,บางกอกน้อย,Bangkok Noi,10,กรุงเทพมหานคร,Bangkok,13.772,100.477,20708
102105,ท่าข้าม,,1021,บางขุนเทียน,Bang Khun Thian,10,กรุงเทพมหานคร,Bangkok,13.555,100.434,57030
102107,แสมดำ,,1021,บางขุนเทียน,Bang Khun Thian,10,กรุงเทพมหานคร,Bangkok,13.605,100.395,122738
102201,บางหว้า,,1022,ภาษีเจริญ,Phasi Charoen,10,กรุงเทพมหานคร,Bangkok,13.714,100.443,37977
102202,บางด้วน,,1022,ภาษีเจริญ,Phasi Charoen,10,กรุงเทพมหานคร,Bangkok,13.723,100.437,29557
102206,บางจาก,,1022,ภาษีเจริญ,Phasi Charoen,10,กรุงเทพมหานคร,Bangkok,13.727,100.45,8199
102207,บางแวก,,1022,ภาษีเจริญ,Phasi Charoen,10,กรุงเทพมหานคร,Bangkok,13.736,100.445,19009
102208,คลองขวาง,,1022,ภาษีเจริญ,Phasi Charoen,10,กรุงเทพมหานคร,Bangkok,13.738,100.423,11240
102209,ปากคลองภาษีเจริญ,,1022,ภาษีเจริญ,Phasi Charoen,10,กรุงเทพมหานคร,Bangkok,13.722,100.464,15083
102210,คูหาสวรรค์,,1022,ภาษีเจริญ,Phasi Charoen,10,กรุงเทพมหานคร,Bangkok,13.727,100.457,6517
102302,หนองแขม,,1023,หนองแขม,Nong Khaem,10,กรุงเทพมหานคร,Bangkok,13.68,100.358,78841
102303,หนองค้างพลู,,1023,หนองแขม,Nong Khaem,10,กรุงเทพมหานคร,Bangkok,13.714,100.351,76388
102401,ราษฎร์บูรณะ,,1024,ราษฎร์บูรณะ,Rat Burana,10,กรุงเทพมหานคร,Bangkok,13.67,100.51,33420
102402,บางปะกอก,,1024,ราษฎร์บูรณะ,Rat Burana,10,กรุงเทพมหานคร,Bangkok,13.675,100.491,49828
102501,บางพลัด,,1025,บางพลัด,Bang Phlat,10,กรุงเทพมหานคร,Bangkok,13.791,100.487,24138
102502,บางอ้อ,,1025,บางพลัด,Bang Phlat,10,กรุงเทพมหานคร,Bangkok,13.802,100.512,25255
102503,บางบำหรุ,,1025,บางพลัด,Bang Phlat,10,กรุงเทพมหานคร,Bangkok,13.781,100.482,19029
102504,บางยี่ขัน,,1025,บางพลัด,Bang Phlat,10,กรุงเทพมหานคร,Bangkok,13.774,100.492,25349
102601,ดินแดง,,1026,ดินแดง,Din Daeng,10,กรุงเทพมหานคร,Bangkok,13.778,100.567,123966
102701,คลองกุ่ม,,1027,บึงกุ่ม,Bung Kum,10,กรุงเทพมหานคร,Bangkok,13.808,100.65,69682
102704,นวมินทร์,,1027,บึงกุ่ม,Bung Kum,10,กรุงเทพมหานคร,Bangkok,,,28023
102705,นวลจันทร์,,1027,บึงกุ่ม,Bung Kum,10,กรุงเทพมหานคร,Bangkok,,,46744
102801,ทุ่งวัดดอน,,1028,สาทร,Sa Thon,10,กรุงเทพมหานคร,Bangkok,13.71,100.532,39763
102802,ยานนาวา,,1028,สาทร,Sa Thon,10,กรุงเทพมหานคร,Bangkok,13.714,100.514,21071
102803,ทุ่งมหาเมฆ,,1028,สาทร,Sa Thon,10,กรุงเทพมหานคร,Bangkok,13.718,100.541,19663
102901,บางซื่อ,,1029,บางซื่อ,Bang Su,10,กรุงเทพมหานคร,Bangkok,13.82,100.529,81838
102902,วงศ์สว่าง,,1029,บางซื่อ,Bang Su,10,กรุงเทพมหานคร,Bangkok,,,44298
103001,ลาดยาว,,1030,จตุจักร,Chatuchak,10,กรุงเทพมหานคร,Bangkok,13.826,100.565,43919
103002,เสนานิคม,,1030,จตุจักร,Chatuchak,10,กรุงเทพมหานคร,Bangkok,,,20065
103003,จันทรเกษม,,1030,จตุจักร,Chatuchak,10,กรุงเทพมหานคร,Bangkok,,,38952
103004,จอมพล,,1030,จตุจักร,Chatuchak,10,กรุงเทพมหานคร,Bangkok,,,31180
103005,จตุจักร,,1030,จตุจักร,Chatuchak,10,กรุงเทพมหานคร,Bangkok,,,24014
103101,บางคอแหลม,,1031,บางคอแหลม,Bang Kho Laem,10,กรุงเทพมหานคร,Bangkok,13.696,100.494,25510
103102,วัดพระยาไกร,,1031,บางคอแหลม,Bang Kho Laem,10,กรุงเทพมหานคร,Bangkok,13.706,100.508,27058
103103,บางโคล่,,1031,บางคอแหลม,Bang Kho Laem,10,กรุงเทพมหานคร,Bangkok,13.694,100.516,37809
103201,ประเวศ,,1032,ประเวศ,Prawet,10,กรุงเทพมหานคร,Bangkok,13.719,100.664,83072
103202,หนองบอน,,1032,ประเวศ,Prawet,10,กรุงเทพมหานคร,Bangkok,13.687,100.656,42765
103203,ดอกไม้,,1032,ประเวศ,Prawet,10,กรุงเทพมหานคร,Bangkok,13.68,100.689,46924
103301,คลองเตย,,1033,คลองเตย,Khlong Toei,10,กรุงเทพมหานคร,Bangkok,13.71,100.57,69264
103302,คลองตัน,,1033,คลองเตย,Khlong Toei,10,กรุงเทพมหานคร,Bangkok,13.723,100.571,11321
103303,พระโขนง,,1033,คลองเตย,Khlong Toei,10,กรุงเทพมหานคร,Bangkok,13.707,100.595,23626
103401,สวนหลวง,,1034,สวนหลวง,Suan Luang,10,กรุงเทพมหานคร,Bangkok,13.726,100.628,121740
103501,บางขุนเทียน,,1035,จอมทอง,Chom Thong,10,กรุงเทพมหานคร,Bangkok,13.694,100.45,37526
103502,บางค้อ,,1035,จอมทอง,Chom Thong,10,กรุงเทพมหานคร,Bangkok,13.702,100.476,35576
103503,บางมด,,1035,จอมทอง,Chom Thong,10,กรุงเทพมหานคร,Bangkok,13.672,100.468,45151
103504,จอมทอง,,1035,จอมทอง,Chom Thong,10,กรุงเทพมหานคร,Bangkok,13.693,100.468,35415
103602,สีกัน,,1036,ดอนเมือง,Don Mueang,10,กรุงเทพมหานคร,Bangkok,13.925,100.593,62838
103604,ดอนเมือง,,1036,ดอนเมือง,Don Mueang,10,กรุงเทพมหานคร,Bangkok,,,82026
103605,สนามบิน,,1036,ดอนเมือง,Don Mueang,10,กรุงเทพมหานคร,Bangkok,,,24032
103701,ทุ่งพญาไท,,1037,ราชเทวี,Rat Thewi,10,กรุงเทพมหานคร,Bangkok,13.763,100.53,32131
103702,ถนนพญาไท,,1037,ราชเทวี,Rat Thewi,10,กรุงเทพมหานคร,Bangkok,13.757,100.538,9047
103703,ถนนเพชรบุรี,,1037,ราชเทวี,Rat Thewi,10,กรุงเทพมหานคร,Bangkok,13.752,100.559,14844
103704,มักกะสัน,,1037,ราชเทวี,Rat Thewi,10,กรุงเทพมหานคร,Bangkok,13.752,100.528,16414
103801,ลาดพร้าว,,1038,ลาดพร้าว,Lat Phrao,10,กรุงเทพมหานคร,Bangkok,13.811,100.612,93338
103802,จรเข้บัว,,1038,ลาดพร้าว,Lat Phrao,10,กรุงเทพมหานคร,Bangkok,13.84,100.6,27662
103901,คลองเตยเหนือ,,1039,วัฒนา,Watthana,10,กรุงเทพมหานคร,Bangkok,13.743,100.56,8612
103902,คลองตันเหนือ,,1039,วัฒนา,Watthana,10,กรุงเทพมหานคร,Bangkok,13.736,100.576,53272
103903,พระโขนงเหนือ,,1039,วัฒนา,Watthana,10,กรุงเทพมหานคร,Bangkok,13.719,100.596,22644
104001,บางแค,,1040,บางแค,Bang Khae,10,กรุงเทพมหานคร,Bangkok,13.698,100.409,39433
104002,บางแคเหนือ,,1040,บางแค,Bang Khae,10,กรุงเทพมหานคร,Bangkok,13.72,100.4,60340
104003,บางไผ่,,1040,บางแค,Bang Khae,10,กรุงเทพมหานคร,Bangkok,13.741,100.385,40262
104004,หลักสอง,,1040,บางแค,Bang Khae,10,กรุงเทพมหานคร,Bangkok,13.683,100.396,52378
104101,ทุ่งสองห้อง,,1041,หลักสี่,Lak Si,10,กรุงเทพมหานคร,Bangkok,13.883,100.564,77494
104102,ตลาดบางเขน,,1041,หลักสี่,Lak Si,10,กรุงเทพมหานคร,Bangkok,13.871,100.58,28094
104201,สายไหม,,1042,สายไหม,Sai Mai,10,กรุงเทพมหานคร,Bangkok,13.921,100.654,78615
104202,ออเงิน,,1042,สายไหม,Sai Mai,10,กรุงเทพมหานคร,Bangkok,13.896,100.672,36104
104203,คลองถนน,,1042,สายไหม,Sai Mai,10,กรุงเทพมหานคร,Bangkok,13.898,100.63,85655
104301,คันนายาว,,1043,คันนายาว,Khanna Yao,10,กรุงเทพมหานคร,Bangkok,13.821,100.677,45794
104302,รามอินทรา,,1043,คันนายาว,Khanna Yao,10,กรุงเทพมหานคร,Bangkok,,,49575
104401,สะพานสูง,,1044,สะพานสูง,Saphan Sung,10,กรุงเทพมหานคร,Bangkok,13.761,100.688,94982
104501,วังทองหลาง,,1045,วังทองหลาง,Wang Thong Lang,10,กรุงเทพมหานคร,Bangkok,13.779,100.609,25472
104502,สะพานสอง,,1045,วังทองหลาง,Wang Thong Lang,10,กรุงเทพมหานคร,Bangkok,,,12430
104503,คลองเจ้าคุณสิงห์,,1045,วังทองหลาง,Wang Thong Lang,10,กรุงเทพมหานคร,Bangkok,,,29826
104504,พลับพลา,,1045,วังทองหลาง,Wang Thong Lang,10,กรุงเทพมหานคร,Bangkok,,,45121
104601,สามวาตะวันตก,,1046,คลองสามวา,Khlong Sam Wa,10,กรุงเทพมหานคร,Bangkok,13.889,100.708,54670
104602,สามวาตะวันออก,,1046,คลองสามวา,Khlong Sam Wa,10,กรุงเทพมหานคร,Bangkok,13.896,100.76,25656
104603,บางชัน,,1046,คลองสามวา,Khlong Sam Wa,10,กรุงเทพมหานคร,Bangkok,13.839,100.7,80949
104604,ทรายกองดิน,,1046,คลองสามวา,Khlong Sam Wa,10,กรุงเทพมหานคร,Bangkok,13.854,100.745,11838
104605,ทรายกองดินใต้,,1046,คลองสามวา,Khlong Sam Wa,10,กรุงเทพมหานคร,Bangkok,13.861,100.786,16394
104701,บางนา,,1047,บางนา,Bang Na,10,กรุงเทพมหานคร,Bangkok,13.672,100.616,92023
104801,ทวีวัฒนา,,1048,ทวีวัฒนา,Thawi Watthana,10,กรุงเทพมหานคร,Bangkok,13.758,100.348,22613
104802,ศาลาธรรมสพน์,,1048,ทวีวัฒนา,Thawi Watthana,10,กรุงเทพมหานคร,Bangkok,13.783,100.39,55277
104901,บางมด,,1049,ทุ่งครุ,Thung Khu,10,กรุงเทพมหานคร,Bangkok,13.651,100.51,54546
104902,ทุ่งครุ,,1049,ทุ่งครุ,Thung Khu,10,กรุงเทพมหานคร,Bangkok,13.614,100.497,66430
105001,บางบอน,,1050,บางบอน,Bang Bon,10,กรุงเทพมหานคร,Bangkok,13.646,100.37,107136
110101,เทศบาลนครสมุทรปราการ,,1101,เมืองสมุทรปราการ,Mueang Samut Prakan,11,สมุทรปราการ,Samut Prakarn,13.593,100.597,0
110102,สำโรงเหนือ,,1101,เมืองสมุทรปราการ,Mueang Samut Prakan,11,สมุทรปราการ,Samut Prakarn,13.649,100.617,0
110103,บางเมือง,,1101,เมืองสมุทรปราการ,Mueang Samut Prakan,11,สมุทรปราการ,Samut Prakarn,13.601,100.622,0
110104,ท้ายบ้าน,,1101,เมืองสมุทรปราการ,Mueang Samut Prakan,11,สมุทรปราการ,Samut Prakarn,13.556,100.599,0
110105,ท้ายบ้านใหม่,,1101,เมืองสมุทรปราการ,Mueang Samut Prakan,11,สมุทรปราการ,Samut Prakarn,13.572,100.621,0
110108,บางปูใหม่,,1101,เมืองสมุทรปราการ,Mueang Samut Prakan,11,สมุทรปราการ,Samut Prakarn,13.526,100.67,0
